{
  "request_summary": "Create a dashboard workflow with backend APIs and an Agentic System observability section.",
  "workflow_classification": ["dashboard_ui", "api_system", "ai_agent_system"],
  "requirements": {
    "business": ["Provide a usable dashboard for enterprise workflow visibility."],
    "functional": ["Generate frontend, backend, API docs, and agent observability."],
    "non_functional": ["Maintainable TypeScript architecture", "Accessible responsive UI"],
    "constraints": ["Do not hardcode secrets"],
    "assumptions": ["Next.js and Node.js are acceptable defaults"]
  },
  "domain_detection": ["frontend", "backend", "llm_agents", "observability", "database"],
  "complexity": {
    "level": "enterprise",
    "reasoning_summary": "Multiple domains and persistent observability justify specialist agents."
  },
  "agent_decision": {
    "required": true,
    "reasoning_summary": "Frontend, backend, database, and observability have independent ownership boundaries.",
    "agents": []
  },
  "execution_topology": {
    "topology_id": "topology.sample",
    "mode": "multi_agent_parallel",
    "nodes": [],
    "edges": [],
    "approval_gates": [],
    "critical_path": [],
    "parallel_groups": []
  },
  "schemas_required": ["orchestrator-response.schema.json", "agent.schema.json"],
  "implementation_plan": ["Analyze workspace", "Generate required agents", "Create project structure", "Validate schemas"],
  "validation_plan": ["Validate JSON schemas", "Run tests", "Review graph updates"],
  "risks": ["Over-generation of agents if cost function is ignored"],
  "outputs": ["Updated orchestrator instruction", "Strict schemas", "Agent registry"]
}
